{
  "reviewer": "security",
  "findings": [
    {
      "title": "pattern-scan.sh unquoted variables cause word-splitting",
      "severity": "P1",
      "file": "scripts/pattern-scan.sh",
      "line": 65,
      "why_it_matters": "When project paths or Java filenames contain spaces, shell word-splitting breaks grep file-list arguments. Filenames starting with '-' may be interpreted as grep options (option injection), altering scan behavior or causing errors.",
      "autofix_class": "safe_auto",
      "owner": "review-fixer",
      "requires_verification": true,
      "suggested_fix": "Quote all file-list variables passed to grep (e.g. \"$controllers\" → use arrays or xargs -0). Add '--' before filenames, e.g.: grep -h '^@RestController' -- $controllers",
      "confidence": 0.85,
      "evidence": [
        "scripts/pattern-scan.sh:65: grep -h \"^@RestController|^@Controller\" $controllers 2>/dev/null",
        "scripts/pattern-scan.sh:69: grep -h '@GetMapping|@PostMapping|@PutMapping|@DeleteMapping|@RequestMapping' $controllers 2>/dev/null",
        "scripts/pattern-scan.sh:147: grep -l '@Transactional' $services 2>/dev/null",
        "scripts/pattern-scan.sh:195: grep -l 'extends JpaRepository' $repositories 2>/dev/null",
        "scripts/pattern-scan.sh:257-292: multiple grep commands using unquoted $entities",
        "scripts/pattern-scan.sh:333-349: multiple grep commands using unquoted $all_configs"
      ],
      "pre_existing": false
    }
  ],
  "residual_risks": [
    "scripts/check-gate-2-exit.sh reads COMPLIANCE_FILE and SPEC_FILE from user-provided PROJECT_DIR; path traversal could read arbitrary files, but the script runs with the invoking user's privileges so impact is limited.",
    "Integration tests create predictable /tmp directories (tinypowers-test-*-$$); symlink race conditions are theoretically possible but low impact in a test context."
  ],
  "testing_gaps": [
    "No integration tests exercise pattern-scan.sh with filenames containing spaces, glob characters, or leading dashes.",
    "No tests verify that gate scripts reject or safely handle symlinked or traversal-containing PROJECT_DIR arguments."
  ]
}
